{
  "id": "MEDUI-CASE-SEMANTICS-UNKNOWN-COLOR-TOKEN",
  "phase": "semantics",
  "source": "source.medui",
  "inputs": {
    "themeTokens": ["Theme.Colors.Title"],
    "textPackages": [{ "locale": "en-US", "keys": ["STR-TITLE"] }]
  },
  "expected": {
    "valid": false,
    "diagnostics": [{ "code": "MEDUI-E030", "line": 8, "column": 16 }]
  }
}
