{
  "id": "MEDUI-CASE-SEMANTICS-MISSING-APPROVED-LOCALE",
  "phase": "semantics",
  "source": "source.medui",
  "inputs": {
    "themeTokens": ["Theme.Colors.Title"],
    "textPackages": [
      { "locale": "en-US", "keys": ["STR-TITLE"] },
      { "locale": "fr-FR", "keys": [] }
    ]
  },
  "expected": {
    "valid": false,
    "diagnostics": [{ "code": "MEDUI-E032", "line": 7, "column": 15 }]
  }
}
